body,subreddit
Moved the goal post. 6 months. Lengthened cycles to 200l,CryptoCurrency
Ahhh!! Crypto!,CryptoCurrency
"My hands grow stronger and my portfolio gets more crypto on every dip

![gif](giphy|d0DdMCREQChi3jGymW)",CryptoCurrency
1002113,CryptoCurrency
[removed],CryptoCurrency
[removed],CryptoCurrency
"If you subscribe to the buy and hold approach, do you want to invest in coins with high ownership by insiders and VCs, who will dump on you later? No. That’s why I prefer coins like Cardano and Ergo that have less centralized ownership.",CryptoCurrency
I just got promoted to bronze and I have no idea how or why.,CryptoCurrency
That’s why a prison wallet is best,CryptoCurrency
[deleted],CryptoCurrency
"It does make more sense in terms of maintaining value. The really neat thing with stable coins would be staking the coin to earn on it while never losing value in the initial investment. That being said, the draw back to stable coins is that they're tied to USD. So if you're in crypto in to get away from fiat it kinda defeats the purpose. Gotta weigh the risk and reward.

Also in a bear market even Bitcoin can go down unlike what OP seems to suggest.",CryptoCurrency
[deleted],CryptoCurrency
lots of people transfering xlm around.,CryptoCurrency
It would increase in price finally,CryptoCurrency
"Don't be an idiot, diversify your assets",CryptoCurrency
Really? That's great. I thought that was purely a meme token,CryptoCurrency
"Yes, however social engineering can be used as a tool to find out more information about OP and use it as leverage",CryptoCurrency
"Guilty until proven innocent - your money that is.  
  
They didn't even charge the guy with anything",CryptoCurrency
[removed],CryptoCurrency
Very good point,CryptoCurrency
Thank you!,CryptoCurrency
[deleted],CryptoCurrency
No sleep for you tonight dude. 3:30 here down under,CryptoCurrency
"(New York) So how can we obtain all information on our buys, and sales, holding, and swaps from Coinbase, and from Trust Wallet that is required for filing our taxes?",CryptoCurrency
Green weekend or riot ![gif](emote|emo_pack_1|gas),CryptoCurrency
Lol this is what made me realize bitboy was only recommending coins that bought him.,CryptoCurrency
"Thanks!

I was quite edging to get to know the infrastructure of cryptocurrencies and then dive into it fully naked to see how long I get to surface... 3 months to date and i need to take a fresh air to get to buy dip and dive little further ...",CryptoCurrency
Weird flex,CryptoCurrency
DREAM: govts operate on smart contracts and a ledger so there is complete transparency with how govt spends money.,CryptoCurrency
Thank you!,CryptoCurrency
"Alright Alright Alright 

Whatcha all buying Tonight?",CryptoCurrency
" I just forced my wife to learn 

I buy everything in her name now as it will be better for tax",CryptoCurrency
“The Slaverse” sounds nice. Can I buy a token for that?,CryptoCurrency
As joe exotic once said… I will never financially recover from this,CryptoCurrency
Lol I’d love to see how many congress people are able to convert a word doc to pdf much less understand crypto,CryptoCurrency
[removed],CryptoCurrency
"For US users, crypto.com has native LUNA.",CryptoCurrency
I would feel like the world is crashing BUT i invested what I can afford to lose,CryptoCurrency
Satossov Nakamolski,CryptoCurrency
"Not sure what the point is honestly…. If I have say $9k in crypto, say USDC that earns 10%, I can take out a loan requiring &gt;3x collateral, so a 3k loan where I have to pay a low percent…. But now I don’t get the earnings…. I’m losing out!

Anyone have an example where you would want to do this?  Otherwise it seems similar to banks where it’s just taking advantage of someone who needs cash immediately, but doesn’t want to sell??  I dunno",CryptoCurrency
Hopefully 3…long time now in accelerating crypto 🙏🏻,CryptoCurrency
"""There’s a lot of conflicting content out there, but make no mistake: you are required to report gains and losses on each transaction or when you earn cryptocurrency, even if the gain or loss is not material. The IRS holds you responsible for reporting all income and transactions whether you receive a tax form from a crypto exchange or not. ""

https://www.coinbase.com/learn/tips-and-tutorials/crypto-and-bitcoin-taxes-US

The technical answer is unfortunately yes. If you wanted to shortcut you could do the... detail available upon request description and put one line for all cost and proceeds. I can't say I advise it, but I believe it's reasonable as long as you have the records to back it up if the IRS inquires.",CryptoCurrency
ALGO is about the future.,CryptoCurrency
"On the safer side: high adoption, room for growth compared to others. 

Riskier: strong community, good or interesting name/logo, potential moon (30x, 50x, 100x, 1000x), available on uniswap or pancake swap, or coinbase, or crypto.com",CryptoCurrency
"See when your company match vests. If it vests immediately, you can take it out and invest it in crypto.

FYI, this is dumb. 401k and HSA are musts",CryptoCurrency
"The misconception is that government controls the currency, the FED controls the flow of FIAT in the U.S, which allow Banks to leverage their assets and lend more than they currently own at nearly 0 risk. I don't know of any government that controls the value or flow of cash, except to borrow more (I could be wrong). For example a friend of mine still believed we were backed by the ""Gold"" standard, value of gold backing FIAT but that was long ago. I don't know a time in history when the people created and gave value to their own currency like we do today. Money changes constantly throughout the last 1000 years, Gold had no real ""Use"" 1000 years ago except for its scarcity. So what gives any value to FIAT other than what we give it? Crypto doesn't change anything in my opinion.",CryptoCurrency
"Nah. They’re actually pretty dope. They donated hundreds of thousands to the ocean cleanup thing that the YouTubers did a month ago, and they just renovated an orphanage.",CryptoCurrency
$100 is a lot to some people. There is also the emotional/sentimental component to recovering a love one’s belongings to help carry on their legacy.,CryptoCurrency
[removed],CryptoCurrency
"BTC: 56k - I don’t think so

BTC: 65k - take my money",CryptoCurrency
Ankr,CryptoCurrency
This is funny because it’s true (for me).,CryptoCurrency
"Realistically it could be 1.5X to 3X, when you consider its current market cap. Maybe…",CryptoCurrency
A bunch would be delegated on the graph protocol forever,CryptoCurrency
Thanks for not yelling this time,CryptoCurrency
[removed],CryptoCurrency
"I hope you're right,  but i fear you're wrong",CryptoCurrency
"Memorise it by creating a story in your mind with bizzare images.  There is actually a very good book on memory and memorization called ""moonwalking with einstein"" that goes into details about how some people are able to train themselves to memorize a deck of shuffled cards after seeing it just once.  Apparently there are competitions for that kind of things.  And yes, everyone can learn how to memorize.  So do yourself a favor and memorize all your pass phrases.  And if you're struggling, pick up this little book and you'll easily learn how it's done.  

I've read the book a few years ago.  And just after I read it I decided to put it to action and memorized a 38 item shopping list within just a few minutes.   It's still stuck in my head to this day.   

I haven't needed to do any long memorization since. But I will definitely read it again before memorizing my pass phrase.",CryptoCurrency
[removed],CryptoCurrency
"&gt; Do you still stand by btc replacing the dollar as the global standard? I mean, I’d be happy if it it takes over gold.

I believe that a cryptocurrency is more likely than not to replace the dollar as the world reserve currency.  I do not believe one will replace it as a daily transactional currency, at least not in my lifetime.  I believe that time is at least 6 years but more likely 10+ away, but I would not commit to it being Bitcoin over others at this point.",CryptoCurrency
[removed],CryptoCurrency
There will always be people far ahead of their time who don't get to see their radical ideas be a reality. Kinda crazy to think about.,CryptoCurrency
LRC + GME is a prime example of what's to come,CryptoCurrency
"This is where you play smart and keep acquiring and staking. 

Sure, Tesla gains are nice, but nobody would turn away from owning a mountain of Disney either.",CryptoCurrency
That's the cost of a deregulated market.,CryptoCurrency
"They are protecting the already rich, if they lose their money who will donate to the next election campaign.",CryptoCurrency
Accurate,CryptoCurrency
[removed],CryptoCurrency
Since when have governments ever protected normal people?,CryptoCurrency
Cardano is a Marshmallow Test.,CryptoCurrency
I’m down,CryptoCurrency
Great project that doesn’t seem to get the love it deserves,CryptoCurrency
"""Is that really a Buffet quote friend?""

\-Some guy on Reddit",CryptoCurrency
What a whore,CryptoCurrency
"Also you can tell your friends that they will still have a tool like taxes. Economically, tax and inflation, are almost the same, however it is much easier for goverments to print more money into the economy than to rise taxes.",CryptoCurrency
DGB,CryptoCurrency
"&gt; This is excellent advice. So you truly advise to not buying anything right now? Is it because you see a crash coming relatively soon or just because you think it's currently trending and will be a sleeper agent in a couple years?

We're in a bull market.  I tell people if you want to buy in the bull market, expect that you're going to be taking bigger chances and doing a bit of timing - gambling.

Buying during bear markets is the safer bet, though not guaranteed to be lower prices than today's prices.",CryptoCurrency
Thank you! I unfortunately had to wait my 2 months to post but knew from reading comments that a post like this would be beneficial... though I didn't think it would explode ha,CryptoCurrency
ETH,CryptoCurrency
Crabbing season is just the calm before the rockets take off,CryptoCurrency
Bought ERG and CKB!,CryptoCurrency
[removed],CryptoCurrency
Where do you live? Can I come visit?,CryptoCurrency
"I’m confused correct me if I’m wrong. So I’ve staked in this crypto and I get rebase rewards every 8 hours, this technically counts as income right? So even if I don’t sell any of my crypto by the end of the year I still have to pay taxes on it even though i really haven’t made any actual money yet?? If I do that is some bullshit",CryptoCurrency
Bel for a quick profit. It's going to pull a GTC this day,CryptoCurrency
You can never go wrong scooping dips. All the best 🤞🏼,CryptoCurrency
BTC without question.,CryptoCurrency
Narrator: We didn’t know it at the time but the real metaverse was all the friends we had made along the way.,CryptoCurrency
Yep. Lots of amazing innovations going on. It is important to keep your blinders off.,CryptoCurrency
"Yup. I've spent 2+ ETH in total throughout a few months to get the teams I want + reaching 10 Axies to get my energy up to 40/day.

Used to be able to earn 7\~8k SLPs a month with 40 energy. Depending on SLP market price (assuming $0.09/SLP), I can trade those 8k SLPs for $720. So $720/month.

Now, maaaybe 3k SLPs a month... And with the current SLP market price... I'm guessing $250 a month tops.",CryptoCurrency
"Thankfully (to some degree), I'm single and don't have to spend a ton of mental energy on this issue. But these comments... A lot of y'all seem to be operating on the premise that your wives can't even be trusted or bothered with your crypto. I'm concerned for y'all. Let her in, teach her the ways, share your most precious cache. What an opportunity for you and your partner to excel together, don't let it just be your thing.",CryptoCurrency
"If you like slow and steady, stable coins are it. 

Fast rough, like a roller coaster, then Bitcoin",CryptoCurrency
Shitboy Crypto,CryptoCurrency
No wrong answers there tbh,CryptoCurrency
"On her phone, look for apps that would hold crypto. This will take some research given all the different apps for exchanges and wallets.

On her computer, look for a file that would be a log of crypto transactions and/or purchases.",CryptoCurrency
Took out a 5k loan in USD to buy BTC at 30k. Worked out beautifully.,CryptoCurrency
CRO,CryptoCurrency
"* **[Bitcoin](https://en.wikipedia.org/wiki/Bitcoin) [Pros](https://reddit.com/r/CointestOfficial/wiki/cointest_archive#wiki_btc_pros) &amp; [Cons](https://reddit.com/r/CointestOfficial/wiki/cointest_archive#wiki_btc_cons)** - Participate in the r\/CC [Cointest](https://reddit.com/r/CointestOfficial/wiki/cointest_policy) to potentially win moons. Prize allocations: 1st - 300, 2nd - 150, 3rd - 75.

* Sort comments as controversial first by [clicking here](https://www.reddit.com/r/CryptoCurrency/comments/r7qlia/bitcoin_investment/?sort=controversial). Doesn't work on mobile.

---        

*I am a bot, and this action was performed automatically. Please [contact the moderators of this subreddit](/message/compose/?to=/r/CryptoCurrency) if you have any questions or concerns.*",CryptoCurrency
"Careful, if you read about ALGO you'll end up buying some and in time it'll have been a great decision.",CryptoCurrency
The reason they get away with calling what Elon did “market manipulation” while youtubers do the exact same is because social media users are sheep. They let influencers influence them into thinking this way. Get the negativity on other celebrities so they can gain artificial trust from naive young people.  They make these young people think they are on their side and against these celebrities and boomers so they can manipulate these people themselves,CryptoCurrency
How has ERGO not taken off yet is beyond me!,CryptoCurrency
Fuck yeah good boy,CryptoCurrency
"Same. If the one thing that gives me hope suddenly vanishes, I would lose all my hope. It’d be hard to find new hope fast enough to make it worth pursuing.",CryptoCurrency
Eh it’s a complex double edged sword really,CryptoCurrency
[removed],CryptoCurrency
Check out the Snek God up in here. He got us right as rain!!!,CryptoCurrency
Bans are rough welcome back.,CryptoCurrency
Thanks for the vertical perspective. Can we get a horizontal one as well?,CryptoCurrency
Better game than Crypto Royale,CryptoCurrency
[removed],CryptoCurrency
Indeed!,CryptoCurrency
"That's the joke, my friend.",CryptoCurrency
With the addition of forge they just made it pay to earn.,CryptoCurrency
Porn always wins it’s like the house but sexier,CryptoCurrency
"**Rule 5 - Content Standards**

- See our [Expanded Rules](https://np.reddit.com/r/CryptoCurrency/wiki/expanded_rules?utm_source=share&amp;utm_medium=ios_app&amp;utm_name=iossmf#wiki_rule_vii_-_content_theft) page for more details about this rule.

- ⁠


- ⁠



[Sub Rules](https://np.reddit.com/r/CryptoCurrency/about/rules/) | [Expanded Rules](https://np.reddit.com/r/CryptoCurrency/wiki/expanded_rules?utm_source=share&amp;utm_medium=ios_app&amp;utm_name=iossmf#wiki_rule_vii_-_content_theft) | [Site Rules](https://www.redditinc.com/policies/content-policy)",CryptoCurrency
![gif](giphy|deLzZu8OhmTYM8RjPJ),CryptoCurrency
[removed],CryptoCurrency
So what your saying is there are subsidies for lunar agriculture?,CryptoCurrency
I use Oceanex in NYS. Zero problems for non-KYC users under 2 bitcoin a day,CryptoCurrency
"Yeah, easy to play, but there's a bit of a learning curve... I can't comprehend how other games are worth billions and this one's got like a $8M market cap (assuming max 400M ROY @$0.02)",CryptoCurrency
Diamond hand for life!,CryptoCurrency
"“So how do we ensure that our scoopers are honest?

The first step is choosing trusted members of the community to run them.”",CryptoCurrency
"Well, shit :(",CryptoCurrency
and turn yourself around.,CryptoCurrency
"Write papers for people, farm RuneScape gold, start a drop shipping company, show your pp",CryptoCurrency
Neat! Definitely the first time I've ever gotten in on anything like this. 😃,CryptoCurrency
"Anyone know much about UNIC?  Listing on Kucoin in 5 1/2 hours.  It's $130+ and only 800,000 supply. Something to do with NFT's.",CryptoCurrency
[deleted],CryptoCurrency
Locked out of Kucoin. All I can do is watch REQ soar from afar,CryptoCurrency
He can get a better APY using the CRO DeFi wallet 13%.,CryptoCurrency
FTX was first. Happened a little while ago,CryptoCurrency
Or 13 Btc,CryptoCurrency
"Matic is not an L2. It is its own blockchain.

Polygon is working on L2s, but those are different projects.",CryptoCurrency
"**Rule 5 - Content Standards**

- See our [Expanded Rules](https://np.reddit.com/r/CryptoCurrency/wiki/expanded_rules?utm_source=share&amp;utm_medium=ios_app&amp;utm_name=iossmf#wiki_rule_vii_-_content_theft) page for more details about this rule.

- ⁠


- ⁠



[Sub Rules](https://np.reddit.com/r/CryptoCurrency/about/rules/) | [Expanded Rules](https://np.reddit.com/r/CryptoCurrency/wiki/expanded_rules?utm_source=share&amp;utm_medium=ios_app&amp;utm_name=iossmf#wiki_rule_vii_-_content_theft) | [Site Rules](https://www.redditinc.com/policies/content-policy)",CryptoCurrency
Exciting! Going to be my first time :),CryptoCurrency
"Ah thanks, Snek God! Was thinking of taking it out and changing to one with fixed terms for higher interest rate.",CryptoCurrency
I bought some land in splinter lands a while back.  It's blown up in price since then.  Later onyoull be able to potentially craft items and resell those.  Honestly just speculation for upcoming events in game that could make passive income,CryptoCurrency
[removed],CryptoCurrency
"I can make your hands  clap 

https://www.youtube.com/watch?v=Y2V6yjjPbX0",CryptoCurrency
Ada looks at home in sea of red,CryptoCurrency
"If I'm filthy rich, I would throw money at that too. It might go 100x who knows? It's like the rich man's shitcoins.

or maybe there's a lot more to it in the future that we don't know",CryptoCurrency
"Matic is part of my portfolio.  I spend weeks and weeks buying it up as other coins in my port do well.  Then on a day like today when it finally pumps, it's nice to skim a bit and buy up everything else. I have an automatic 15% threshold rebalance strategy with about 14 different coins, equally weighted in the portfolio, then I've got my eth and btc in a different portfolio that I've got a 10% threshold rebalance setup on.  That seems to work out well.  Over the past several weeks I've seen the amount of eth and btc both going up as it kicks profits back and forth. This is all done through Shrimpy for anyone wondering.",CryptoCurrency
I was addicted to buying LINK for the longest time. About 15 straight purchases lol,CryptoCurrency
farting up a storm,CryptoCurrency
Been lurking a while and Just learning bout these moons. Down the rabbit hole I go to figure this out...,CryptoCurrency
"Correct. Monero wallets, transaction amounts, and transaction participants are, by themselves, very secure.

The only ways for an entity can trace your wallet/transactions is through honeypotting. If you check your wallet balance on a 3rd party website collecting your browsing info, or deposit/withdraw at a public atm, or transact with wallets deliberately recording your transaction history, that information is collected and used to construct a wallet profile that is cross referenced with similar profiles. At best, this is an approximation of an identity.

In short, a transaction protocol is only as secure as its end user. Should someone wise up to being tracked online, all they need to do is send their monero to another wallet and not do the above mentioned compromising acts.",CryptoCurrency
CRO looking like it will pump again in a week or 2,CryptoCurrency
"Last time I jokingly made a comment shilling a token on one of these types of threads, the same thing happened. People thought I was serious. It's a crazy world",CryptoCurrency
[removed],CryptoCurrency
I like to zoom it zoom it,CryptoCurrency
"Yeah, I agree with these, mostly for SYS. Because the NEVM makes SYS seems to look like a Hybrid of ETH. And also LUXY is built on SYS blockchain that is 100% scalable 💯💯",CryptoCurrency
How do I check?,CryptoCurrency
[removed],CryptoCurrency
"31st December.

Guessing there's another poll then. At least I hope there is .....",CryptoCurrency
Feels good not to be alone than lol,CryptoCurrency
"Here's a list some have KYC like Binance

https://bitcourier.co.uk/blog/crypto-launchpads",CryptoCurrency
"* **[Bitcoin](https://en.wikipedia.org/wiki/Bitcoin) [Pros](https://reddit.com/r/CointestOfficial/wiki/cointest_archive#wiki_btc_pros) &amp; [Cons](https://reddit.com/r/CointestOfficial/wiki/cointest_archive#wiki_btc_cons)** - Participate in the r\/CC [Cointest](https://reddit.com/r/CointestOfficial/wiki/cointest_policy) to potentially win moons. Prize allocations: 1st - 300, 2nd - 150, 3rd - 75.

* Sort comments as controversial first by [clicking here](https://www.reddit.com/r/CryptoCurrency/comments/r6ywb3/in_2013_wired_destroyed_the_key_to_13_btc_now/?sort=controversial). Doesn't work on mobile.

---        

*I am a bot, and this action was performed automatically. Please [contact the moderators of this subreddit](/message/compose/?to=/r/CryptoCurrency) if you have any questions or concerns.*",CryptoCurrency
Crypto Royale is the easiest way to earn money without investing. I started playing this game last week. This game made me discover more about cryptocurrency and I love it.,CryptoCurrency
"Be advised, the website cointelegraph.com has proven to be an unreliable source of information. 


*I am a bot, and this action was performed automatically. Please [contact the moderators of this subreddit](/message/compose/?to=/r/CryptoCurrency) if you have any questions or concerns.*",CryptoCurrency
Now I get to stand my ground virtually. Trespass on my digital space and I’ll turn off your on switch.,CryptoCurrency
[removed],CryptoCurrency
Yes something like that 😁,CryptoCurrency
People having selling their thoughts allowing you to rent their mind for money they need to buy food. Thats a sad thought to be honest.,CryptoCurrency
So I ask this out of genuine curiosity. What's stops us from slowly transitioning into other stable coins. I know it won't happen overnight. But isn't it possible for the liquidity in Tether to eventually be moved to another stablecoins like USDC overtime without any crazy ripple effect?,CryptoCurrency
Can't wait to watch the videos where they ask idiotic questions,CryptoCurrency
"There is no virtual card for Canadians. Mine took 3ish weeks to arrive I think, but I don't remember when it changed from issued to shipped.",CryptoCurrency
It amazes me how often it's recommend.,CryptoCurrency
"“The anonymity of paying using crypto-currencies means they have been favoured for criminal activities such as drug dealing and ransomware attacks.”

They just had to put that in the article….",CryptoCurrency
Bruhh,CryptoCurrency
"Monaco also had terrible customer service. In fact, the earliest investors in Monaco were scammed. Then Monaco changed their name to crypto.com.",CryptoCurrency
[removed],CryptoCurrency
Yes I posted several times but I did know it was shiwn even for people who already have seen it,CryptoCurrency
I remember when Matic was doing its run and everyone was talking about it. Guess they are waiting for their break-even now,CryptoCurrency
Haha I rememeber my XLM days. They were painful. I broke even and moved on.,CryptoCurrency
You gonna tax strike ?,CryptoCurrency
"**Rule 5 - Content Standards**

- See our [Expanded Rules](https://np.reddit.com/r/CryptoCurrency/wiki/expanded_rules?utm_source=share&amp;utm_medium=ios_app&amp;utm_name=iossmf#wiki_rule_vii_-_content_theft) page for more details about this rule.

- ⁠


- ⁠



[Sub Rules](https://np.reddit.com/r/CryptoCurrency/about/rules/) | [Expanded Rules](https://np.reddit.com/r/CryptoCurrency/wiki/expanded_rules?utm_source=share&amp;utm_medium=ios_app&amp;utm_name=iossmf#wiki_rule_vii_-_content_theft) | [Site Rules](https://www.redditinc.com/policies/content-policy)",CryptoCurrency
The market has never been this indecisive in my 2 years of crypto trading. We have been consolidating in such a tiny range. This goes to show how far we have come.,CryptoCurrency
Just whatever you do don't look at the price. Focus entirely on the beautiful logo.,CryptoCurrency
[removed],CryptoCurrency
"we control the horizontal, we control the vertical.

&amp;#x200B;

https://www.youtube.com/watch?v=FCcdr4O-3gE",CryptoCurrency
"Yes they will, but they will charge you extra for it",CryptoCurrency
I bought the dip. Did you?,CryptoCurrency
[removed],CryptoCurrency
"Yeah yeah layer 2 this layer 2 that but WHY? 

Someday there will be an echo system that revolves around a block chain that actually works at high  RPMs.  Some day there will be a block chain that works with huge astronomical amounts of transactions happening all at once. 

ETH will be looked at like I look at a cassette player. The cassette player used to be the coolest thing I owned then came a CD player now it’s mp3s 

ETH is already dead and it doesn’t even know it yet.",CryptoCurrency
NFT's and their technology has the potential to be good and with 100% certainty will be good. But currently most NFT's are just cash grabs with no value.,CryptoCurrency
[removed],CryptoCurrency
Stfu and we’ll see you tomorrow buddy.,CryptoCurrency
"Honestly I get annoyed when people don't use Signal, lol. It feels like I'm stepping back at least a decade using SMS.",CryptoCurrency
