body,subreddit
Typically by hosting it on a centralized service and merely hyperlinking it from the NFT's metadata.  Arweave and IPFS are two semi-decentralized solutions a lot of projects like to use.,CryptoCurrency
"Yup, It's a feast for us.",CryptoCurrency
"$4000, you're kidding, right? The floor on bored apes is like 50 ETH",CryptoCurrency
Prognosis negative. Someone dropped a fucking junior mint in the market.,CryptoCurrency
"Nano, but for monkeys.",CryptoCurrency
That is an auto generated message by Reddit. That is not what the bot said. Go back to your post and have a look at the **comment** that was left.,CryptoCurrency
Could you imagine a whale buying most of the tickets to a popular event and reselling them,CryptoCurrency
"Doge isn't a bad idea but it lacks the faith of people to become more than a meme. Its had time but it isn't ""selling"" itself. Look at what Shiba Inu coin has done in such a short time as far as where you can use it for payment (Lowe's, Gamestop, AMC theaters, Newegg) and in its short history.

I'm not shilling for shib I just think it's important to see how one community is pushing to drastically keep upping itself and branding and one isn't.",CryptoCurrency
Exactly why i say this everytime someone says were crashing.... IF YOU SELL YOUR COIN YOU ARE DOING IT WRONG.,CryptoCurrency
"Portland Oregon, USA",CryptoCurrency
"Look at the charts before huge pumps, like the ATH or ATH of the year. Find what the price was before it jumped. If it's close to where it is now, but it.",CryptoCurrency
I am 90% stocks and 50% of those are dividend paying stocks and 10% crypto . I am investing more in crypto and plan on increasing my allocation to 20 % of my portfolio as I see the chance for better returns from crypto going forward. Also I think it is the future of finance going into the next Decade.,CryptoCurrency
"Hello, your post was removed because your account is less than 60 days old or you do not have the required 500 **comment** karma to make post submissions.",CryptoCurrency
Try mama Tom yum flavour! Delicious!,CryptoCurrency
IMO that is what is happening to crypto right now. The coins that have no use other than to pump and dump and the NFTs. We will see but I think to many people are chasing a fomo and they get torched,CryptoCurrency
Has a cult leader,CryptoCurrency
Maybe in a few decades you can triple your money! Smart contacts 1.1 ought to roll out then,CryptoCurrency
![gif](giphy|OMsLlke4MWlmE),CryptoCurrency
"Waiting for SOL to go up, hope it hits a new ath by the year end.",CryptoCurrency
I think the buying price would be surely low so that he is selling now.,CryptoCurrency
Gosh would be so cool to meet a bunch of celebs who don't give a fuck about me and are only at the party to get paid and promote themselves!,CryptoCurrency
I miss what happened during the movies.,CryptoCurrency
"Yeah actually buying GET was a huge pain in the ass. It was one of the first companies i found when I started go research crypto and it was the first thing I bought after setting up metamask. $300 of GET and like $100 in gas fees. Huge turn off. I'm sure their are easier ways, i just haven't done it",CryptoCurrency
Dip down because of huge heist?,CryptoCurrency
[removed],CryptoCurrency
[removed],CryptoCurrency
I had a friend who used to occasionally drive us home from the bar late at night and sometimes on this long straight road he would gun it to like 100 mph and cross over to the wrong side of the road. We’d be terrified screaming at him and he’d laugh and laugh and say things like “don’t you feel safer with a designated driver?!?”  This shit the whales are pulling on these mini shakeouts reminds me a lot of that.,CryptoCurrency
Any of bitboys eoy predictions.,CryptoCurrency
[removed],CryptoCurrency
ICP to $1000,CryptoCurrency
Monero and Grin. Eventually privacy will be necessary,CryptoCurrency
"Those people who are there for the tech, are also there for the money believe it or not lol",CryptoCurrency
[deleted],CryptoCurrency
I’ve seen a lot of bands. I can’t wait to see them. High expectations in a huge arena.,CryptoCurrency
Earn enough to diversify and strengthen my portfolio to get myself TWO Lambos…Maybe buy myself some KNOWLEDGE.,CryptoCurrency
Adam who?,CryptoCurrency
"A few months ago I warned some people here that it's probably not a great time to get into Doge and that there's better gains available elsewhere in the space.  

I got argued with and downvoted hard. 

Now that It's ""down and out"" it's probably actually a good time to pick up a little Doggie bag.  And It wouldn't be surprised if this gets downvoted too. 😂",CryptoCurrency
Very possible for say Christmas of 2025,CryptoCurrency
"I actually love seeing what other people think of as retirement money... Varies so much depending on where you plan to live and what your lifestyle average is.

What are you working towards?",CryptoCurrency
"Very interesting! I didn't realise you can get a CRO card here? 🤔

What exchanges are you using?

I had Coinbase disable all trade and swap buttons for me after I submitted my ID. Can't seem to get MOX or HSBC work with Crypto.com. Want to check out Gemini today since Ive seen their ads in trams - must work here somehow?

I'm using Coinunited.io ATMs at the moment to wire money in, but so far no idea how it can get anything out.",CryptoCurrency
"I understand the reason for this post, but these poor unfortunate souls who bought 9 months ago at 64k could have sold a few weeks ago at 64k broke even and walked away forever. People who see btc has a good investment opportunity while continue to hold for a bit longer until they can make some better money off of it.",CryptoCurrency
"Let’s not explain it to you. Let’s not try shilling it. Let’s in fact ask you not to buy it. 

Truth is you still buy it, so do you really need our input? And on the off chance you’re not, that’s okay by is because that’s more for us.",CryptoCurrency
"What’s that website that compares market caps again? 
Like what would the price of eth be if it had btc market cap",CryptoCurrency
"&gt;This is the way.

This is the way.",CryptoCurrency
You wouldn't know. He left when you were just a babe.,CryptoCurrency
Also what happened to Moons by the way lol? Do they have a website/twitter for progress etc?,CryptoCurrency
Actually it’s pretty much the truth. Only difference is are the if statements hand coded or produced by learning algorithm:),CryptoCurrency
"I read the whitepaper, but that's what I did.

Ymmv",CryptoCurrency
"Yieldly offering 3,000% APY on choice coin and now choice coin is 300% up",CryptoCurrency
"Money is now worthless, cost of living and debt by everyone is skyrocketing. We are all inside one giant Ponzi scheme.

Crypto is our way out.",CryptoCurrency
"Reminiscing the good times when BTC was 60k, will get there sooner or later.",CryptoCurrency
Toe sucking?,CryptoCurrency
"Okay, thanks.  I just did.  I need at least 500 characters.  :(",CryptoCurrency
"Thank you for this!  


For anyone interested I've collated these into a Twitter List for easy viewing:  
https://twitter.com/i/lists/1470246952134594563?s=20",CryptoCurrency
"Ada refers to you as ""Champ""",CryptoCurrency
Coingecko &amp; Coinmarketcap,CryptoCurrency
Rose is blooming 🌹,CryptoCurrency
Bro I am 100% in NFT’s for the money.,CryptoCurrency
The chances are literally zero.,CryptoCurrency
Binance is a fucking house of cards.,CryptoCurrency
Double Triple shit ton.,CryptoCurrency
"Most people are bitching at the fact that they missed the SOL train at $3... or BNB at $1.

SOL is revolutionary, and unless people understand how PoS and PoH work together, they will not understand the need for high grade equipment or insane speed requirements of the network.",CryptoCurrency
"Pretty good tbh, a few interesting ISPO's coming up you can stake your ADA for.",CryptoCurrency
"This can go both ways. Either way this isn't good at all considering Singapore as a no. 1 crypto friendly country. Shady shit is going on with binance or singapore, or both.",CryptoCurrency
You misspelled sneks 🐍,CryptoCurrency
An adrenaline junkie like me loves these kind of volatility. I mean how else am I supposed to stay awake all night long?,CryptoCurrency
"I’ve been reading about dot and parachain auctions on this sub but i have no clue what they are and why i should care.

Wtf are moonbeam, acala, etc? Why are you shilling them here?

TIA.",CryptoCurrency
Only if we can spend it without converting to fiat,CryptoCurrency
"That’s what I plan on doing, going to diversify my portfolio outside of crypto within the next few months once all my debt is paid off.",CryptoCurrency
if you think high gas fees are bad you might not understand what’s going on here,CryptoCurrency
thecoinperspective.com,CryptoCurrency
Lol i hope not cos my bag is huge :(,CryptoCurrency
I'll walk myself out!,CryptoCurrency
I feel like Luna will be that price in 5-10 years..,CryptoCurrency
"To which clubs?

I mean that sounds just another bullshit hype claim.",CryptoCurrency
"Short term I have to re-evaluate my original plan. Original plan was expecting the “blow off top”. I’m mentally preparing myself that we might not get one. I think the biggest lesson I’ve learned in my short year in crypto is if everyone is expecting something to happen, it usually doesn’t.",CryptoCurrency
"You know after a 75% loss that it’s still #11 overall by market cap, right?

Did you know it had a 24 hour volume of over 1 billion?

Did you know it’s the 4th most accepted cryptocurrency for retail business after BTC, ETH, and LTC?

I’m no Doge fanboy, but the fact Doge is still above .05 is unreal.

“The reports of my death are greatly exaggerated”

* Mark Twain
* Bitcoin
* Dogecoin",CryptoCurrency
Dude everyone was a nobody once how do people not see this,CryptoCurrency
Far up or down?,CryptoCurrency
"Yes likely. They need to adapt, adopt or die off.",CryptoCurrency
Wish this was on Coinspot. I have $2k of it sat in a coinbase wallet which I hate using.,CryptoCurrency
Is he still married?,CryptoCurrency
ICP to $800,CryptoCurrency
"Ridiculous like the time the US government seized all citizens' gold in 1930s following the Great Depression?

https://en.wikipedia.org/wiki/Executive_Order_6102",CryptoCurrency
"Radio stations are nearly a thing of the past. Not dead yet, but definitely mostly displaced by streaming.",CryptoCurrency
Gawd.. These shills!!,CryptoCurrency
*Supply shock incoming*,CryptoCurrency
"Yes, crypto dot com. They can have crazy spreads when  cryptos skyrocket. Apparently they have an exchange outside the United States that's more reasonable. I still use them for some things. 

Honestly, though, their app is easy to use and user friendly. They are getting brand recognition. I suspect that they will continue growing quite a bit.",CryptoCurrency
They making money on the spread?,CryptoCurrency
CoinGecko lists market caps. Just go from there,CryptoCurrency
Early adopters of SOLANA could be the greatest gainers of the year. Congratulations.,CryptoCurrency
There must be some update regarding this on eth 2.0 update.,CryptoCurrency
"Your [text post](https://www.reddit.com/r/CryptoCurrency/comments/rf79s7/jsksjsjskd/) was removed for not having a high enough character count and therefore violating rules 2 &amp; 5. Please resubmit as a comment in the daily thread or submit a new post with at least 500 characters.

---


*I am a bot, and this action was performed automatically. Please [contact the moderators of this subreddit](/message/compose/?to=/r/CryptoCurrency) if you have any questions or concerns.*",CryptoCurrency
"Use an exchange with limit orders if you're buying any significant amount that would make a huge difference to you.  

Buy ""$100"" worth of x crypto and only get $95 worth... I can live with that. 

Buy $10,000 and get $9500.... Not great.",CryptoCurrency
"I agree. I think ppl find it hard to see the legitimate application of NFTS due to the number of scams. Ppl like Jordan Belfort pile into the NFT market to just milk cow and earn a quick buck.

99% of NFTs are absolute trash and in most cases you're better off holding your ETH or SOL medium term then buying the NFT.

but just because there are scams doesn't mean NFTs themselves aren't useful.",CryptoCurrency
"Hello, your post was removed because your account is less than 60 days old or you do not have the required 500 **comment** karma to make post submissions.",CryptoCurrency
You jest but rent in my town has gotten out of fucking control. It really is like an actual problem.,CryptoCurrency
Wonder what this means for Bitrue,CryptoCurrency
"Future whale, checking in.",CryptoCurrency
Mia Khalifa nfts. This one sparks joy,CryptoCurrency
is the market not crashing right now??!!,CryptoCurrency
"As with any other investment, only put in what you and your heart can afford to lose.",CryptoCurrency
"Honestly, if you have enough of a token to be a whale, you can easily make money. Unfortunately, we're here. Look at the timeline, we're ready to MOON",CryptoCurrency
I bought it and wish I bought more 😂😭,CryptoCurrency
[removed],CryptoCurrency
They have enough money to do a lot of things.,CryptoCurrency
Hahah!,CryptoCurrency
So are you bearish on moons??,CryptoCurrency
[removed],CryptoCurrency
It's all inside the universes metaverse thats inside the worlds universe brah,CryptoCurrency
End of month or next,CryptoCurrency
"I have to buy Doge via an ATM and swap it for ALGO every time I want to contribute to my stack.

3 days ago I got 1402 Doge and swapped it for 151 ALGO. Yesterday I took the same amount of money to do the same thing... 1402 Doge for 153 ALGO. 

New stable coins alert 😂

Market is just in a stand still right now. Now the question is - is it the calm before the storm? Or everyone's off for Xmas? 🤔",CryptoCurrency
[removed],CryptoCurrency
Nice! Decentralized exchanges are the future.,CryptoCurrency
As long as your self aware your better than most of these ada tards,CryptoCurrency
[removed],CryptoCurrency
I love your moon count,CryptoCurrency
( o ) ( o ),CryptoCurrency
"Im just messing around with coinbase earn, lets see if eth at 4k, axs at 105 or gala at .61 is the winner 24 hours from now. :D",CryptoCurrency
"Well, my portfolio today isn't terribly different from yesterday, but GALA is a nice bright spot.

I'm getting used to this market now, I'm more annoyed that I can't figure out why I have a chat notification in Reddit that won't go away than I am by the crypto market.  Still, I hope that we start a steady string of green days... and that I figure out why I have this ghost notification, lol.",CryptoCurrency
"Those two usually go hand in hand, in my experience",CryptoCurrency
[removed],CryptoCurrency
[removed],CryptoCurrency
It depends on many factors but yeah you can go and ape in. As long as you're willing to take risks.,CryptoCurrency
[removed],CryptoCurrency
Blessing and a curse. There is so much unnecessary content just for moon farming.,CryptoCurrency
Wow - TiL Coinbase is even lamer than I thought,CryptoCurrency
"That's the hopium I was needing. 

Here, have a reward.",CryptoCurrency
What does he base this on? Lol. So comical,CryptoCurrency
Funny way to interpret what I said but ok.,CryptoCurrency
"Okay tell me, why would I ever need to use this token? If you can give me a good answer, it is good project. Otherwise, it is not.",CryptoCurrency
[removed],CryptoCurrency
"I live in Italy and I find very hard to vote for some party. Being pro-crypto would be a point, but there are arguments which are more relevant right now.
Since recently EU has proposed a crypto semi-friendly regulation and Portugal is going to become the European pole for crypto investors, I assume Italy will mantain a neutral position on the matter and just apply whatever comes from EU.

The problem for cryptos will be nothern european states, which are pushing against POW based technologies claiming that their power requirements are dangerous for the pollution they generate.",CryptoCurrency
As a Florida crypto miner I too support this.,CryptoCurrency
I'd pretty much say 99.999999% of the crap I've spouted on reddit has been crypto related. And I'm just a normal schmo on reddit.,CryptoCurrency
Man the Cardano shills really are out in force aren't they,CryptoCurrency
[removed],CryptoCurrency
[removed],CryptoCurrency
Go on buddy . make your therapist buy some of the cryptos lol.,CryptoCurrency
"So in that same token (pun intended), does that mean market depth is one good way of predicting price movement?",CryptoCurrency
I DCA’d into Chainlink more last week during the big dip and I hate myself for it. It’s never performed how I want it to but I know if I sell it it’ll pump so here I am 🤡,CryptoCurrency
[removed],CryptoCurrency
Companies allocate funds to different divisions.,CryptoCurrency
"Got 4 acres cheap, it digital swampland though, 2 eth for the lot. Theres even a virtual indian burial ground and nude swimming hole.",CryptoCurrency
"Yeah, you can't buy banano in Kalium. It's just a wallet. If you have some nano/xno there are some pages you can directly swap them. The biggest exchanges where you can buy banano at the moment are coinex and hotbit.",CryptoCurrency
300B is equivalent to 10% of Britain GDP,CryptoCurrency
[removed],CryptoCurrency
[removed],CryptoCurrency
Then better get a bull dozer!,CryptoCurrency
Not all heroes wear capes. Unless you wear a cape for some reason sir,CryptoCurrency
"No Maw, ADAs my coin, I'll do it. *Loads Shell*

Jk, Cardano fans",CryptoCurrency
Im one of the suckers that bought in near ATH's. Slowest rugpull ever.,CryptoCurrency
"TIL, OP will sell out his soul for that sweet sweet gains!!!!",CryptoCurrency
I don’t understand how solving a complicated math problem verifies a transaction.,CryptoCurrency
I guess you can finally leave your parents basement. Congratz,CryptoCurrency
Dracula wants to know your location.,CryptoCurrency
Predict it everyday lol. He's definitely gonna get it someday.,CryptoCurrency
"A lot if people do and often you’ll see stories of people switching banks because of it. Did you know most banks won’t let you buy crypto to protect you? Kind of stupid. 

An extreme example (taken from earlier this year) can be 3rd world countries getting taken over leaving your funds locked in banks (because everyone is cashing out) while you try to escape the country with the $5 in your back pocket. With decentralization you just need that 12 words in your seed and an internet connection to access them later on.",CryptoCurrency
[removed],CryptoCurrency
[removed],CryptoCurrency
Profit? Tax? Sell????,CryptoCurrency
Crypto.com must spend so much advertising I swear I see it everywhere,CryptoCurrency
How is 0.53 half of 92.98?,CryptoCurrency
"Currently holding in the Algorand Wallet for the max APY% it offers without a stake (I think 5%). I hope my comment wasn't misleading. 

I will be transferring to an exchange or the like to stake but I am currently looking myself for a place to stake most of my holdings. Any advice is welcome.",CryptoCurrency
[removed],CryptoCurrency
[removed],CryptoCurrency
"This just in. Rich dad Poor dad has gone tits up, he’s bankrupt.",CryptoCurrency
this market has been in a strange place for a couple of weeks now.  While not exciting...it is a good time to accumulate and HODL.,CryptoCurrency
"“Amid his gloomy predictions, Kiyosaki recommends buying bitcoin. In August, he said bitcoin is the investment with the greatest upside. In October, he said bitcoin has a “very bright” future. **Last month, he revealed that he was buying more bitcoin and ether as inflation concerns intensified.**”",CryptoCurrency
"Dem or Repub, this isn’t that controversial anymore.",CryptoCurrency
"I like the idea. I'm definitely going to look more. Thank you, the risk was my worry. Appreciate your help",CryptoCurrency
[removed],CryptoCurrency
"Lol, I left on a six hour drive an hour ago and I am still not there yet.",CryptoCurrency
Looks like that everyone is just a broke college kid out here lmao,CryptoCurrency
Yea because fuck parachains,CryptoCurrency
xD,CryptoCurrency
[removed],CryptoCurrency
[removed],CryptoCurrency
No one expects the litecoin inquisition,CryptoCurrency
"Honestly tho, memes aside, why not USDC?",CryptoCurrency
[removed],CryptoCurrency
[removed],CryptoCurrency
They are probably using messenger. Them using discord is giving them too much credit.,CryptoCurrency
"That posse of clowns, let you down",CryptoCurrency
"&gt;You missed the point that if you reside (183 days per year) in PR for 10 years you only pay 5% cap gains on everything made before you moved and started your Act 22 company. 

That’s a good point. But if OP has 1 year seasoning on investment, long term capital gains tax is up to 20%. So personally, I’d rather wait 1 year and pay 20% vs living in PR for 10 years to pay 5%. YMMV

&gt;Every year you can harvest $40-80k tax free depending on your marital status plus all cap gains through your Act 22 company are zero.

Same in the US. 0% taxes on long term capital gains for $40,400 single or $80,800 married.",CryptoCurrency
"I'm just buying whatever people shill, atleast one of them will moon",CryptoCurrency
hahaha this is fun,CryptoCurrency
[removed],CryptoCurrency
Crazy! I had no idea it was still around. I know that all the big corporations that bought places in second life pulled out a long time ago but that’s kind of awesome that it’s still around.,CryptoCurrency
[removed],CryptoCurrency
All my homies hate News Corp,CryptoCurrency
"Protocols are the new banks

Choose wisely",CryptoCurrency
"Oh no - if the oracle says - that’s what it is. Problem is that I don’t even know why I’m writing it. No offence, but people generally are fucking morons so it will probably happen and he will masturbate to being right. Chicken or the morons? Or something like that….",CryptoCurrency
[removed],CryptoCurrency
This sub fucking hated algo because of the accelerated vesting just 6 months ago and now it’s a darling.,CryptoCurrency
[removed],CryptoCurrency
[removed],CryptoCurrency
Just pay your taxes and live in the US.,CryptoCurrency
There is no one in the meta.,CryptoCurrency
"Why such an obsession for the whales, they're the ones who will wreck the market, we need organic growth",CryptoCurrency
ADA was hyped bigtime and I kick myself for falling for it.,CryptoCurrency
[removed],CryptoCurrency
Realized gains are the friends we made along the way,CryptoCurrency
"Until I'm not scared shitless everytime I make transactions on blockchains, it's not ready for mass adoption.",CryptoCurrency
I feel this. Wholesome af.,CryptoCurrency
Astroport is coming. It will be the money market of the terra ecosystem,CryptoCurrency
Nope. I agree. Most people I talk to still do not get it. Very early days still,CryptoCurrency
You've been in since 2017 and are down 75%? That sounds like a you problem bud.,CryptoCurrency
"Decentralized law suits coin is going to be the most bridged coin, so bullish.",CryptoCurrency
"""The two officials have recently issued a call for the prohibition of energy-intensive mining of digital currencies across the European Union, citing various concerns including the migration of miners to other destinations after China’s crackdown. In the Nordic region, for example, their appetite for renewable energy could undermine the transition towards climate neutrality and the efforts to meet the Paris Agreement goals.""
https://news.bitcoin.com/swedish-regulators-call-for-eu-ban-on-crypto-mining-power-company-defends-industry/",CryptoCurrency
Hahaha what are we speaking about again?,CryptoCurrency
Can we all  just focus on the regret of not buying Bitcoin in 2010 instead?,CryptoCurrency
"&gt; *Do you think it'll make a resurgence?*

Unless they hire an expert marketing team and pull off some big partnerships, no.",CryptoCurrency
But it does. There is no room for corruption in the infrastructure of cryptocurrency.,CryptoCurrency
"Shit was good just a week ago or was it. 

Anyone remember this freestyle?",CryptoCurrency
That inflation already happened in which crypto and stocks went parabolic.,CryptoCurrency
Even mambo #5?,CryptoCurrency
Improbably,CryptoCurrency
"&gt;I’d much rather it grew the right way, under the radar, without the influence of politics.

Bitcoin has been around for over a decade. Scrypt PoW for 1 decade. Eth has been around since 2015.

How much more growth under the radar do you want?",CryptoCurrency
No,CryptoCurrency
"I see you, can you see me?",CryptoCurrency
Buy productive assets that pays me cash,CryptoCurrency
Lol fundamentals in crypto,CryptoCurrency
Baby steps. You see them all the time. Like the latest is the new ledger card.,CryptoCurrency
[removed],CryptoCurrency
"My FEELINGS tell me Julian was probably arrested by 111IIIlllIII 

lmfao",CryptoCurrency
"I was talking about this before. Just didn't want to mention the name because people would get rekt lol.

It baits you in with huge profits. But it takes a pretty huge investment to get them. If you are late to the party you will get rugged by whales just like in this game.

Saw a guy stream this shit on twich. He was making 4k a day out of this shit browser game. Basically preaching and hyping this garbage to all his viewers. Tons of people chased those same profits. And not soon after whales pulled their profits at the same time.

It happened before btc whent down from like 50k.

I guarantee media is going to find some kid that gambled all his money into something like this and they will all blame crypto for it.",CryptoCurrency
